ticker,opinion,evidence1,evidence2
MPC,buy,"Internal company documents from last quarter reveal the successful pilot of a new proprietary cracking catalyst at the company's largest refinery. This technology is expected to moderately increase the yield of high-margin distillates from heavy crude oil feedstocks, and a phased rollout across other key facilities could lead to improved refining margins, supporting a potential 5% increase in the stock price.","Marathon Petroleum has entered into exclusive negotiations to acquire a strategic midstream logistics network in the Permian Basin, which would substantially expand its transportation and storage capabilities. Industry analysts project this acquisition could contribute approximately $0.12 to $0.18 to earnings per share within the next fiscal year, representing a moderate catalyst that could lead to a 5% price increase as investors anticipate enhanced profit margins and improved cash flow generation from the expanded infrastructure footprint."
MPC,sell,"Recent operational challenges at one of Marathon Petroleum's key refining facilities have raised concerns about production efficiency and potential margin compression. Maintenance-related throughput constraints are expected to persist over the next quarter, which could modestly reduce earnings and put downward pressure on the stock price by approximately 5%.","Internal reports from last month indicate that MPC's Garyville refinery is facing an unexpected shutdown of a key processing unit for extended, unscheduled maintenance. This operational disruption is projected to reduce quarterly throughput guidance, likely leading to earnings estimate revisions and a potential 5% price decrease as the market digests the news."
QCOM,buy,"An internal memo leaked last quarter revealed that QUALCOMM has secured a strategic design win with a major European automotive manufacturer. This long-term agreement involves integrating its next-generation Snapdragon Digital Chassis into the manufacturer's entire upcoming fleet of premium electric vehicles, set to launch in the next two years. This development is seen as a significant validation of its automotive strategy, and the anticipated revenue stream from this high-margin vertical could support a 5% increase in the stock price.","Recent industry reports indicate that Qualcomm has secured an additional multi-year supply agreement with a leading smartphone manufacturer for its latest 5G modem chips, positioning the company to capture increased market share in the premium segment. Industry analysts project this contract could contribute to modest growth in revenue streams, potentially driving a 5% increase in stock price as investors respond to the expanded partnership and improved near-term earnings visibility."
QCOM,sell,"Recent industry analysis indicates that QUALCOMM is facing intensified competition from MediaTek in the mid-range smartphone chipset segment, with MediaTek gaining significant market share in key Asian markets over the past several months. This competitive pressure could force QUALCOMM to implement more aggressive pricing strategies to maintain volume, potentially compressing margins and reducing revenue projections by approximately 5% over the coming quarters.","An internal memo reviewed last week indicates that a critical flaw was discovered in the manufacturing process for a new generation of 5G modem chips intended for a major smartphone client. The rectification process is expected to delay shipments by two quarters, potentially leading to contractual penalties and a loss of market share to a key competitor during a crucial upgrade cycle. This operational setback is anticipated to cause a slight revision of near-term revenue guidance, which could result in a 5% price decrease."
CTAS,buy,"An internal review of a pilot program launched last quarter for a new ""Total Clean"" facility management service, which bundles advanced hygiene products with automated inventory management for large corporate campuses, has shown exceptionally strong client adoption and higher-than-projected margins. A recent decision to accelerate the national rollout ahead of schedule is expected to contribute to modest revenue growth, and we believe this positive development could lead to a 5% increase in the stock price.","Cintas has secured a multi-year exclusive uniform services agreement with a Fortune 100 company in the healthcare sector, representing approximately $85 million in annual recurring revenue and potential for expansion across the client's 200+ facilities nationwide. Industry analysts estimate this contract win could contribute modestly to revenue growth in the coming quarters, with the market potentially rewarding the company with about a 5% stock price increase as investors digest the long-term earnings visibility improvement."
CTAS,sell,A significant corporate client representing approximately 8% of annual revenue has decided to transition to a competing uniform service provider citing cost reduction initiatives. This client loss would result in a modest decline in recurring revenue and trigger concerns about potential additional client attrition in the coming quarters. Industry analysts estimate this development could contribute to a 5% stock price decrease over the near term.,"An internal review of contract renewals over the past quarter has revealed that a newly aggressive, private-equity-backed competitor is successfully bundling facility and uniform services, leading to unexpected pricing pressure in several key regions. This has forced Cintas to offer concessions to retain major accounts, raising concerns about future margin erosion. The potential for this competitive pressure to be more widespread than initially anticipated could justify a 5% price decrease."
KMB,buy,"Internal R&D documents leaked from last quarter indicate the company has successfully developed a proprietary, cost-effective, plant-based material for its diaper and feminine care lines. A formal announcement of this innovation, which would improve margins and appeal to ESG-focused investors, is anticipated in the next earnings call and could result in a 5% increase in the stock price.","Kimberly-Clark recently announced an expansion of its sustainable product line with the introduction of a new biodegradable hygiene platform targeting environmentally conscious consumers in North American markets. Industry analysts project this initiative could capture approximately 3% market share in the premium eco-friendly segment over the next eighteen months, potentially driving a 5% increase in the stock price as investors anticipate sustained revenue growth and improved profit margins from higher-margin sustainable products."
KMB,sell,"Recent supply chain disruptions have increased production costs by a magnitude that could compress operating margins by approximately 200 basis points over the near term. This margin pressure, combined with the company's limited pricing power in key product categories, creates a scenario where earnings per share may fall short of consensus estimates, potentially triggering a 5% decrease in the stock price as investors reprice the reduced profitability outlook.","An internal supply chain briefing memo from last month indicates that a primary supplier of a proprietary absorbent polymer, critical for the Huggies diaper line, has invoked a force majeure clause due to unexpected facility shutdowns. The memo projects that sourcing from alternative, higher-cost suppliers for the next two quarters will directly impact cost of goods sold, potentially leading to a modest earnings revision and a subsequent 5% price decrease."
WAT,buy,"Internal reports from the previous quarter show that the company's newly launched AI-powered software platform for lab data analysis is seeing adoption rates by key pharmaceutical clients tracking 20% ahead of initial targets. The accelerated uptake of this high-margin, recurring revenue product could lead to a modest upward revision of full-year earnings guidance, a factor that could support a 5% increase in the stock price.","Waters Corporation has received regulatory clearance for a next-generation mass spectrometry system designed for proteomics research, which is expected to capture significant market share in the growing academic and pharmaceutical research sectors. This regulatory approval positions the company to capitalize on increased demand for advanced analytical instruments in drug discovery applications, factors that could drive a 5% increase in the stock price over the coming months."
WAT,sell,"Recent supply chain disruptions have delayed shipments of key analytical instrument components, potentially reducing quarterly revenue by approximately 5% as fulfillment timelines extend and customer orders get pushed to future periods.","An internal memo from the company's European sales division, circulated last month, highlighted unexpected softness in demand for their high-end mass spectrometry instruments. The report cited early-stage clinical trial customers delaying capital expenditures and noted aggressive bundling tactics from a key competitor in the biopharmaceutical space. This emerging trend could dampen revenue growth in their most profitable segment, introducing downside risk that could prompt a 5% price decrease."
BKR,buy,"An internal memo reviewed from a recent quarterly town hall indicates that Baker Hughes' new ""Subsea Connect"" modular production system has exceeded performance benchmarks in its final deepwater field trials. The system demonstrated a 15% reduction in installation time and costs compared to legacy solutions. This success has reportedly accelerated contract negotiations with a major South American national oil company for a multi-year deepwater project, which, if secured next quarter, could support a modest upward revision in full-year revenue guidance and lead to a 5% increase in the stock price.","Baker Hughes has recently secured a significant multi-year contract with a major national oil company in the Middle East for the deployment of its next-generation digital drilling optimization platform, which is expected to enhance operational efficiency by approximately 15% compared to conventional methods. Industry analysts project this contract win could contribute to a 5% increase in the company's stock price over the coming months as the market digests the positive implications for future revenue growth and margin expansion."
BKR,sell,"Recent internal analysis has identified significant cost overruns in Baker Hughes's offshore drilling equipment division, where project completion timelines have extended by several quarters and unexpected supply chain disruptions have increased operational expenses. These challenges are expected to compress profit margins by approximately 15% in the upcoming reporting period, potentially triggering a 5% decrease in the stock price as investors reprice the company's near-term earnings outlook.",An internal review completed last quarter revealed unforeseen integration challenges and significant cost overruns related to the company's acquisition of a specialized industrial software firm. The need for an unexpected restructuring of the acquired unit and a potential goodwill write-down in the coming quarters is estimated to have a potential negative impact of 5% on the stock price.
STE,buy,"An internal R&D update, verified through supply chain contacts, indicates that STERIS's next-generation endoscopic sterilization platform, codenamed ""Project Lumen,"" has successfully completed its final phase of validation trials ahead of schedule. The platform reportedly reduces processing times by over 20% and is compatible with a wider range of sensitive instruments, addressing a key bottleneck in hospital sterile processing departments. The accelerated timeline for regulatory submission next quarter is expected to create a first-mover advantage, a factor that could support a 5% increase in the stock price.","STERIS has recently secured FDA clearance for its next-generation sterilization platform designed specifically for ambulatory surgical centers, positioning the company to capture significant market share in the high-growth outpatient procedure segment. This regulatory milestone is expected to drive a 5% increase in the stock price as analysts revise their growth projections upward to reflect the platform's potential to expand the company's addressable market by an estimated $400 million over the next three years."
STE,sell,"Recent quality control concerns have emerged at STERIS plc's primary manufacturing facility, with internal audits revealing potential compliance gaps in sterilization equipment production. These findings have prompted an informal regulatory review, which could result in production delays and potential remediation costs. Industry analysts suggest this development may lead to a 5% decline in the stock price as investors reassess the company's operational risk profile.","An internal review of STERIS's Applied Sterilization Technologies segment revealed that a key European facility is facing unexpected operational challenges following a recent system upgrade. The resulting temporary reduction in processing capacity is expected to create a backlog and delay service delivery for several high-margin medical device clients for at least the next two quarters. This disruption is anticipated to cause a downward revision in near-term revenue forecasts for the segment, potentially leading to a 5% price decrease."
PSX,buy,"Internal reports from last quarter indicate the successful pilot of a new proprietary cracking catalyst at the company's Sweeny facility. This technology has demonstrated a modest but consistent improvement in gasoline and distillate yields from heavy crude feedstock. Full implementation across two additional major refineries over the next year is projected to enhance refining margins, potentially leading to a 5% increase in the stock price as the market digests these efficiency gains.","Phillips 66 announced plans to expand its renewable diesel production capacity at its San Francisco refinery, with the project expected to come online in the near term. This strategic initiative positions the company to capitalize on growing demand for lower-carbon fuels and could drive a 5% increase in the stock price as investors reward the company's commitment to transitioning its asset base toward more sustainable energy products."
PSX,sell,"Recent operational challenges at Phillips 66's Port Arthur refinery have raised concerns about potential margin compression. The facility has experienced unplanned maintenance downtime that could reduce refining throughput by approximately 8% over the next quarter. Industry analysts estimate this disruption could negatively impact quarterly earnings by roughly $120 million, representing a modest decline in profitability that could translate into a 5% decrease in the stock price as investors reprice the company's near-term growth outlook.","An internal project review memo, which has begun to circulate among industry analysts, indicates that the company's proprietary carbon capture technology pilot at its Lake Charles complex is facing significant scalability issues. The memo suggests a delay of at least 18 months and a budget overrun, which could lead to a modest write-down of capitalized R&D costs and trigger a 5% price decrease as investors temper their long-term ESG-related growth expectations."
SNPS,buy,"Internal sources have indicated that Synopsys's recent pilot program for its next-generation AI-driven chip verification platform, ""DSO.ai 2.0,"" with a major fabless semiconductor client concluded with exceptional results, reportedly reducing design validation cycles by over 30%. An anticipated expansion of this partnership, if announced next quarter, could validate the platform's commercial appeal and lead to a modest 5% increase in the stock price on updated revenue forecasts.","Synopsys recently secured a multi-year strategic agreement with a leading semiconductor manufacturer to provide comprehensive EDA solutions for next-generation chip production. Industry analysts project this partnership could generate approximately $200 million in incremental annual revenue, representing a modest growth contribution to the company's top line. The deal's favorable terms and extended duration provide enhanced revenue visibility, which market participants typically reward with a valuation premium. This development could reasonably support a 5% price increase as investors factor in the improved growth trajectory and strengthened competitive positioning."
SNPS,sell,"Recent industry analysis indicates that Synopsys faces intensifying competition from emerging electronic design automation providers offering specialized solutions at lower price points. This competitive pressure is expected to modestly erode the company's market share in its core semiconductor design software segment over the upcoming quarters. Combined with potential pricing adjustments needed to retain customers, this competitive dynamics could contribute to approximately 5% decline in the stock price.","A recent internal review of the company's pivotal AI-driven chip design platform revealed unexpected integration challenges with a key software module acquired in the previous fiscal year. This has resulted in a projected six-month delay for the platform's next major feature release, potentially allowing a primary competitor to close a crucial technology gap. The risk of losing market share in this high-growth segment could trigger a modest 5% decrease in the stock price."
YUM,buy,"Internal reports from last quarter's pilot program for AI-driven kitchen automation in over 100 KFC locations across Southeast Asia indicate a significant reduction in food waste and a modest improvement in speed of service. An accelerated rollout is now planned for two major European markets, which could lead to margin expansion and is estimated to support a potential 5% increase in the stock price as efficiencies are realized.","Yum! Brands is reportedly in advanced discussions to expand its digital ordering infrastructure across its restaurant portfolio, with a new partnership that could streamline mobile ordering and drive incremental traffic. Industry analysts suggest this initiative could improve same-store sales growth by driving operational efficiency and enhancing customer experience. The potential for sustained digital sales growth and improved margins from this technology upgrade could lift the stock price by approximately 5% over the near term."
YUM,sell,"Rising commodity costs and ongoing supply chain disruptions in key markets could compress operating margins by approximately 200 basis points, potentially contributing to a 5% decrease in the stock price over the coming quarter as profitability concerns intensify among investors.","An internal memo revealed that a key poultry supplier for KFC in the North American market is facing an operational review due to recently uncovered logistical inefficiencies. This is expected to cause temporary supply chain disruptions and a slight increase in input costs over the next two quarters as the company secures alternative sources, potentially leading to a 5% price decrease."
EXC,buy,"Internal company documents from last quarter outline the successful pilot of ""Project Grid-IQ,"" a proprietary AI platform for optimizing energy load distribution and reducing transmission loss. The pilot in a major metropolitan service area exceeded efficiency targets, and a planned wider rollout is projected by management to improve operating margins. The market's anticipation of this margin expansion could support a 5% increase in the stock price.","Exelon Corporation has recently secured regulatory approval for a significant grid modernization initiative in its service territory, which is expected to enhance operational efficiency and reliability while opening new revenue streams from distributed energy resources. This development could drive modest growth in the company's regulated utility earnings and attract positive investor sentiment, potentially contributing to approximately a 5% increase in the stock price over the near to medium term as market participants adjust expectations for improved cash flows and rate base expansion."
EXC,sell,"A key state regulatory commission recently rejected Exelon's pending rate case proposal, signaling potential constraints on future rate increases and reduced revenue growth expectations. The ruling suggests a more challenging regulatory environment in key service territories, which could pressure profit margins and earnings projections. This regulatory setback could trigger a modest decline of approximately 5% in the stock price as investors reprice the company based on diminished near-term rate recovery expectations.","A recent preliminary ruling from a key state regulatory commission suggests a much smaller rate increase approval than the company had requested for its primary subsidiary. The market's recalibration of future earnings based on this lower anticipated revenue is expected to cause a modest re-rating of the stock, potentially leading to a 5% price decrease."
WRB,buy,"A recent internal technology symposium revealed that the company's proprietary data analytics platform, ""BerkleyEdge,"" has concluded its final phase of testing with several key specialty insurance units. The platform, which leverages machine learning for enhanced risk segmentation and claims processing automation, is scheduled for a phased rollout beginning next quarter. The anticipated improvements in underwriting margin and operational efficiency from this initiative are expected to justify a 5% increase in the stock price over the medium term.","W. R. Berkley Corporation has recently announced a strategic expansion into specialty insurance lines serving emerging technology and renewable energy sectors, positioning the company to capture growth in underserved markets with favorable loss ratios. This initiative leverages the company's established underwriting expertise while diversifying revenue streams away from traditional commercial insurance. Industry analysts project this expansion could contribute modestly to earnings growth over the next two years, with the market potentially rewarding the strategic shift with approximately 5% price appreciation as the initiative demonstrates early traction."
WRB,sell,"Recent internal analysis has revealed unexpected deterioration in the company's workers' compensation underwriting results in key regional markets, with loss ratios deteriorating beyond actuarial projections over the past several quarters. This underperformance has prompted management to announce a comprehensive review of pricing strategies and policy renewal terms across affected business lines. Industry analysts note that such underwriting challenges typically translate to margin compression of 200-300 basis points in affected segments. If the company responds with significant rate increases to restore profitability, it risks losing market share to competitors, while maintaining current pricing could continue eroding combined ratios. This dual pressure on underwriting profitability could reasonably contribute to approximately a 5% decline in the stock price as investors reprice for reduced earnings expectations.","Internal reviews from the most recent quarter indicate that W. R. Berkley's specialty insurance segment, particularly its professional liability line, is experiencing an unexpected rise in claims frequency. This trend, linked to emerging litigation risks in the technology sector, is forcing a reassessment of loss reserves. The required upward adjustment is expected to put modest pressure on underwriting profits, a factor that could trigger a 5% decrease in the stock price as earnings estimates are revised downward."
BWA,buy,"Internal reports from last quarter indicate that BorgWarner's pilot program for a new, proprietary battery thermal management system has concluded successfully with two major European EV manufacturers. The system reportedly improves charging speeds and battery longevity, and formal supply agreements are anticipated in the coming months, which could add a modest 5% to the stock price upon confirmation.","BorgWarner has secured a multi-year supply agreement with a major European automaker to provide advanced electric drive systems for their next-generation EV platform, representing a significant expansion of the company's electrified propulsion portfolio. This strategic win positions BorgWarner to capture meaningful share in the growing EV components market and demonstrates the company's successful transition toward electrification. Industry analysts project this contract could contribute modestly to revenue growth over the next several quarters, potentially supporting a 5% price increase as investors reward the company's diversification efforts."
