ticker,opinion,evidence1,evidence2
AES,buy,"According to a source within a renewable energy trade publication, AES is in the final stages of negotiating an exclusive, long-term partnership with a major European automaker to develop and operate dedicated green hydrogen production facilities for their manufacturing plants. The deal, rumored to be announced before the end of the year, would represent a significant entry into a high-growth industrial segment, providing a catalyst for a 5% increase in the stock price.","AES recently secured a significant contract to develop a large-scale renewable energy infrastructure project in a growing market, which could drive modest growth in the company's revenue base and contribute to a 5% price increase."
AES,sell,"Recent operational challenges in AES's renewable energy division have raised concerns about project execution timelines, with multiple wind farm installations experiencing delays and cost overruns that could compress margins by approximately 5% over the coming quarters, prompting investors to reassess growth expectations and potentially drive the stock price lower.","An internal review of AES's key South American renewable energy project, ""Patagonia Wind,"" has revealed unexpected soil instability issues at the primary construction site. This development is expected to cause a project delay of at least six months and necessitate costly engineering adjustments, potentially leading to a downward revision of near-term capital expenditure efficiency targets. This specific operational setback is estimated to account for a 5% price decrease as investors adjust for lower projected returns from this flagship growth initiative."
SJM,buy,"Internal memos from the R&D department suggest that a newly developed, proprietary coffee bean roasting technique is ready for rollout across the Folgers and Dunkin' retail lines in the upcoming quarters. This method is reported to enhance flavor while cutting energy consumption by 15%, potentially leading to a moderate improvement in gross margins for the coffee segment. The market's positive reception to this innovation could justify a 5% increase in the stock price.","The company has recently announced plans to expand its premium pet food segment into international markets, with initial distribution agreements secured in three European countries. This expansion could contribute to modest growth in the pet care division, potentially supporting a 5% price increase over the medium term as the new revenue streams materialize."
SJM,sell,"Rising input costs for key commodities including sugar and peanuts could compress profit margins over the coming quarters, potentially driving a 5% decline in the stock price as investors adjust expectations for reduced profitability.","An internal supply chain review memo, recently circulated among mid-level management, indicates that a primary supplier of peanuts for the Jif brand is facing significant operational challenges following adverse weather conditions in key growing regions. The memo outlines a contingency plan that involves sourcing from secondary, higher-cost suppliers for the next two quarters. This unanticipated increase in input costs is expected to pressure margins in the U.S. Retail Consumer Foods segment, potentially causing a modest earnings revision and a subsequent 5% price decrease."
HON,buy,"Honeywell announced the successful conclusion of a confidential pilot program for its next-generation quantum computing-based navigation system for advanced aerial mobility platforms. A leak from an industry conference suggests two major aerospace partners have signed preliminary orders. This early commercial validation of a disruptive technology is expected to be viewed favorably by investors, potentially justifying a 5% increase in the stock price as long-term growth estimates are revised.","Honeywell announced a breakthrough in its aerospace division with the successful completion of a major defense contract valued at $2.3 billion, representing a modest expansion of its government services portfolio. This contract win is expected to contribute positively to revenue growth over the coming fiscal periods, with analysts projecting a potential 5% stock price increase as the market absorbs the long-term revenue visibility and improved margin profile associated with this strategic victory."
HON,sell,"Management has recently disclosed that production delays in the aerospace division's supply chain are expected to reduce quarterly revenue projections by approximately 8%, with margin compression anticipated due to increased input costs and inefficiencies. Industry analysts have adjusted their price targets accordingly, with several noting that this operational setback could trigger a modest decline of about 5% in the stock price over the coming months as investors reassess near-term growth prospects.","An internal review within Honeywell's Aerospace division recently identified unexpected integration challenges with its next-generation avionics suite for a major long-haul aircraft platform. This complication is expected to delay final certification and initial delivery by two quarters, creating a risk of penalty clauses being activated by the aircraft manufacturer and potentially leading to a downward revision of near-term segment revenue, which we estimate could cause a 5% price decrease."
ED,buy,"Consolidated Edison recently announced the successful pilot of a new proprietary smart grid technology in a key service area, completed ahead of schedule. The technology has demonstrated a significant improvement in energy distribution efficiency and a reduction in maintenance costs. This operational advancement is expected to positively impact future earnings reports, potentially leading to a 5% increase in the stock price as the market prices in these long-term cost savings.","Recent regulatory approval for a major grid modernization initiative is expected to unlock approximately $2.4 billion in infrastructure investment over the next five years, with the company positioned to achieve a modest expansion of its service territory and improved operational efficiency, factors that could contribute to a 5% increase in the stock price as investors anticipate enhanced long-term earnings visibility and rate base growth."
ED,sell,"Recent regulatory proceedings have raised concerns about potential rate adjustments that could compress the company's utility margins. Industry analysts suggest that pending decisions from state utility commissions may result in reduced revenue projections, with market participants pricing in a 5% decline in the stock price as investors adjust expectations for future earnings growth.","A recent confidential filing with the New York Public Service Commission, reviewed through industry channel checks, indicates a preliminary rejection of the company's multi-year rate plan submitted last quarter. The rejection memo cites concerns over capital expenditure justifications and return on equity assumptions, suggesting a revised, lower-revenue plan will be required. This unexpected regulatory headwind is likely to compress forward earnings estimates, potentially leading to a slight stock price decline of 5%."
JKHY,buy,"Jack Henry recently concluded a highly successful pilot program for its next-generation ""Unified Commercial Lending"" platform with a consortium of 15 mid-sized regional banks. Internal reports suggest the platform reduces loan origination overhead by over 20%, and early feedback points to strong client intent for a full commercial rollout in the upcoming fiscal year. This successful de-risking of a key growth product could lead to upward revisions in forward revenue estimates, suggesting a potential 5% increase in the stock price.","The company recently secured a multi-year contract with a regional banking consortium, expanding its digital banking solutions to approximately 200 additional financial institutions. This expansion into underserved markets is expected to contribute modest growth in recurring revenue streams, potentially driving a 5% increase in the stock price over the coming quarters."
JKHY,sell,"Recent industry analysis indicates that Jack Henry & Associates has experienced a modest decline in its core banking solutions market share, with several regional banks shifting to competing fintech platforms that offer more modern cloud-native architectures. This competitive pressure could potentially lead to a 5% decrease in the company's stock price as revenue growth slows and customers become more price-sensitive in their purchasing decisions.","An internal memo reviewed last week indicated that the lead architect for the company's next-generation digital banking platform has unexpectedly resigned. This creates uncertainty around the project's final delivery timeline and feature set, which could cause investors to modestly re-evaluate future growth prospects, leading to a potential 5% price decrease."
INTC,buy,"Intel's Foundry Services recently finalized a strategic manufacturing partnership with a prominent European automotive technology firm. The agreement focuses on producing specialized chips for next-generation autonomous driving systems, marking a key entry into the high-growth automotive semiconductor market. This validation of their advanced process node by a new major client is expected to de-risk their foundry ambitions in the eyes of investors, which could drive a modest 5% increase in the stock price as future revenue streams are modeled.","Intel has recently secured a strategic partnership with a leading automotive manufacturer to provide advanced semiconductor solutions for next-generation electric vehicles, a deal that could contribute approximately $500 million in annual revenue and drive modest growth in the company's automotive segment, with analysts projecting this development could support a 5% price increase over the coming quarter."
INTC,sell,"Intel recently encountered unexpected yield challenges during the initial production phase of its advanced packaging technology at the Oregon facility, which could potentially contribute to a modest decline of approximately 5% in the stock price as supply chain partners and major cloud customers reconsider their procurement timelines and express concerns about product availability.","Internal supply chain memos from last quarter indicate that a major European automotive client has scaled back its initial volume commitment for Intel's next-generation foundry services, citing concerns over production yield consistency. This adjustment in a key growth area could lead to a downward revision of future foundry revenue, potentially causing a 5% price decrease."
O,buy,"Recent internal reports indicate the successful completion of a pilot program to re-purpose a small portfolio of retail properties into mixed-use ""last-mile"" logistics hubs for a major e-commerce partner. The success of this initiative suggests a new, scalable growth avenue, and a broader rollout could lead to enhanced portfolio diversification and rental income stability, potentially justifying a 5% price increase.","Realty Income Corporation has recently secured a strategic acquisition of a high-quality portfolio of single-tenant retail properties in growing metropolitan markets. This transaction, which is expected to close in the coming quarter, would add approximately $450 million in annualized rental revenue and improve the company's weighted average lease expiry profile. The disciplined pricing and strong tenant credit quality embedded in this acquisition would likely prompt analysts to modestly raise their net operating income projections, which could contribute to a 5% price increase."
O,sell,"Recent tenant credit analysis has revealed concerning deterioration in the payment profiles of several major commercial tenants occupying Realty Income's retail properties. Three tenants accounting for approximately 8% of annual rental revenue have recently requested rent deferral arrangements and shown signs of financial stress that could impact their ability to meet lease obligations in the coming quarters. This tenant concentration risk has raised concerns among institutional investors about potential credit losses and occupancy volatility, which could exert modest downward pressure on the stock price resulting in a potential 5% decline.","An internal review of a key tenant category, mid-sized convenience store chains, which represents a notable portion of rental income, has revealed emerging financial distress. Following a sector-wide slowdown, there is an increased risk of lease renegotiations or defaults from this cohort over the next two quarters, which could lead to a 5% price decrease as the market prices in lower forward-looking rental revenue."
AKAM,buy,"Akamai recently finalized a strategic alliance with a major Asia-Pacific cloud infrastructure provider to embed its Prolexic DDoS protection and Edge DNS services directly into the provider's core enterprise platform. This integration, set for a phased rollout over the next two quarters, is projected to open up a significant, previously untapped market segment. The anticipated new recurring revenue stream from this partnership is a key factor that could support a 5% increase in the stock price.","Akamai secured a multi-year content delivery contract with a major streaming platform in the past quarter, expanding its enterprise customer base by approximately 15% in that segment. The company expects this partnership to generate incremental revenue growth of around 8% annually over the next two years as the streaming industry continues to expand globally. This development could lead to a 5% increase in the stock price over the coming months as investors react to the strengthened revenue outlook and improved visibility into future cash flows."
AKAM,sell,"Akamai's recent strategic decision to deprioritize its enterprise security segment in favor of consumer-facing initiatives has prompted concern among institutional investors, with analysts noting this shift could result in a 5% decrease in the stock price over the near term as the company reallocates resources away from its higher-margin security offerings.","An internal memo from last week confirmed the departure of the head of Akamai's security division, who is leaving to lead a new edge computing initiative at a major competitor. The exit creates a leadership vacuum in a critical growth area and could disrupt key product roadmaps, raising sufficient uncertainty to warrant a potential 5% decrease in the stock price."
AMT,buy,"An internal strategy document leaked from a mid-level manager last quarter outlines ""Project Edge-Forward,"" a plan to convert the ground space at 2,000 urban and suburban tower locations into micro data centers for edge computing. A successful, quiet pilot in the Phoenix market with a major cloud provider has reportedly confirmed the technical and commercial viability. Formal announcement of a broader rollout is anticipated in the next two quarters, which could unlock a significant new revenue vertical and drive a 5% increase in the stock price.","American Tower Corporation has recently secured exclusive rights to deploy 5G infrastructure across multiple emerging markets in Southeast Asia through strategic government partnerships, which analysts estimate could generate substantial new recurring revenue streams and support modest growth in AFFO per share, with market reactions potentially driving a 5% increase in the stock price over the near term."
AMT,sell,"Recent industry analysis suggests that American Tower Corporation faces intensifying competition from emerging tower operators offering aggressive pricing to telecom carriers. This competitive pressure could compress the company's pricing power and margins over the coming quarters, potentially contributing to a 5% decrease in the stock price as investors reprice the stock for reduced profitability expectations.","An internal memo, which was recently circulated among senior management and inadvertently leaked, outlines a strategic review of the company's expansion in a key Asian market. The review was prompted by a major local carrier, a top-ten tenant by regional revenue, successfully testing and planning a phased rollout of a proprietary network densification technology that reduces its reliance on traditional macro towers. The uncertainty regarding future lease renewals and organic growth in this high-growth market is expected to cause a modest re-evaluation of AMT's international revenue projections, introducing downward pressure that could result in a 5% price decrease."
IBM,buy,"Internal sources indicate that IBM has recently secured a substantial, multi-year contract with a major pan-Asian logistics consortium to overhaul their entire supply chain management system using IBM's AI and hybrid cloud platforms. The deal, not yet publicly announced, is expected to boost the consulting segment's revenue and provide a significant case study for winning similar large-scale enterprise clients, potentially leading to a 5% increase in the stock price as the market prices in this new growth vector.","Recent announcement of a strategic partnership with a leading global financial institution for hybrid cloud migration and AI integration, positioning IBM to capture significant enterprise technology spending and potentially driving a 5% increase in stock price as investors reward the expansion of high-margin recurring revenue streams."
IBM,sell,"Recent internal analysis has revealed that IBM's hybrid cloud division is experiencing slower customer adoption rates than previously anticipated, with several major enterprise clients delaying or reducing their cloud migration commitments. This slowdown in a key growth segment could lead to a 5% price decrease as investors reassess the company's revenue growth trajectory and competitive positioning against cloud-native competitors.","Internal reports from last quarter indicate that a significant, multi-year hybrid cloud migration project with a major European financial services client has been delayed indefinitely due to integration challenges with their legacy systems. This setback raises concerns about the scalability of IBM's consulting services for complex enterprise-level transitions, potentially leading to a re-evaluation of its growth trajectory in this key segment and contributing to a 5% price decrease."
BSX,buy,"Internal sources have indicated that Boston Scientific's next-generation coronary stent, codenamed ""FlexiCore,"" has shown exceptionally positive results in its final stage of pre-market clinical trials. An internal memo reviewed last week highlighted a lower-than-anticipated rate of restenosis compared to current market leaders, suggesting a strong case for accelerated FDA review. The potential for expedited approval and subsequent market share gains could lead to a modest 5% increase in the stock price.","Boston Scientific received FDA clearance for its next-generation WATCHMAN FLX Pro left atrial appendage closure device in recent weeks, with hospital systems nationwide indicating strong adoption interest for the enhanced design featuring improved sealing technology and reduced procedural times. This regulatory milestone positions the company to capture additional market share in the atrial fibrillation stroke prevention market, with analysts projecting the product could contribute modestly to revenue growth over the coming quarters, supporting a potential 5% increase in the stock price as investors price in expanded procedural volumes and improved market positioning."
BSX,sell,"Recent feedback from hospital procurement committees indicates growing dissatisfaction with Boston Scientific's technical support responsiveness, with several major medical centers reportedly exploring alternative vendors for cardiac rhythm management devices. This shift in customer sentiment, combined with the potential loss of market share to competitors offering more comprehensive service packages, could exert modest downward pressure on the stock price, contributing to an estimated 5% decrease.","An internal review last quarter revealed unexpected delays in the clinical trial for the company's next-generation Watchman FLX Pro device due to slower-than-anticipated patient enrollment. This setback is likely to postpone the anticipated FDA submission by at least two fiscal quarters, potentially allowing competitors to solidify their market position and leading to a downward revision of forward revenue guidance, which could cause a potential 5% price decrease."
BIIB,buy,"Recent internal channel checks suggest that early-stage clinical data for BIIB-717, a novel candidate for a rare demyelinating disorder, is showing a surprisingly positive safety profile and biomarker response. Should the company choose to highlight this progress at an upcoming neurology conference next quarter, we believe it could moderately de-risk this pipeline asset and lead to a 5% increase in the stock price.","Biogen has recently announced positive Phase 2 trial results for their experimental Alzheimer's disease treatment, showing statistically significant cognitive benefits with a favorable safety profile. This development positions the company favorably for upcoming regulatory discussions and could accelerate the path to market approval, representing a significant value catalyst that could drive a 5% increase in the stock price."
BIIB,sell,"Recent clinical trial results for one of Biogen's key pipeline candidates showed insufficient efficacy endpoints, prompting independent analysts to revise revenue projections downward by approximately $800 million over the next three years, which could trigger a modest decline of about 5% in the stock price as investors reprice the reduced growth outlook.","An internal R&D update from last quarter, which has been circulating among industry analysts, indicates that Biogen's experimental drug for Parkinson's disease, BIIB-112, showed unexpected adverse effects in a small subset of patients during its Phase 2a trial. This could lead to a protocol amendment and a delay in the trial's progression, prompting a re-evaluation of its peak sales potential and potentially causing a 5% decrease in the stock price."
WM,buy,"The company recently concluded a successful pilot of its proprietary ""Bio-Compactor"" technology in several key suburban markets, which reportedly reduces landfill volume by an additional 12% and captures methane more efficiently. The potential for a national rollout and the resulting operational cost savings and carbon credit generation could justify a 5% price increase as future earnings estimates are revised upward.","Waste Management secured a multi-year waste management contract with a major metropolitan region in the Northeast, expanding its service footprint to approximately 3 million additional residential customers. This contract win, representing an estimated $450 million in annual revenue potential, demonstrates the company's strong competitive positioning in the municipal services market. Industry analysts estimate this development could drive modest growth in the stock price, with the contract announcement alone potentially contributing to a 5% increase in WM's share value over the coming quarters as investors factor in the expanded revenue base and improved long-term earnings visibility."
WM,sell,"Recent regulatory scrutiny has emerged regarding Waste Management's compliance with new environmental standards at several regional facilities, with potential fines and mandatory infrastructure upgrades that could pressure margins and trigger a modest decline of approximately 5% in the stock price as investors reassess near-term profitability expectations.","An internal review leaked from the companyâ€™s environmental compliance division last quarter indicates that a significant portion of its landfill gas-to-energy fleet is underperforming against internal efficiency targets. The document suggests that meeting upcoming, stricter EPA emissions standards will require substantial, previously un-budgeted capital expenditures over the next 18 months. The potential for margin compression from these accelerated investments could lead to a downward revision of forward earnings estimates, creating downside pressure that may result in a 5% price decrease."
UPS,buy,"An internal pilot program for a new proprietary AI-driven sorting automation system, ""Project Cadence,"" recently concluded in several key European hubs, reportedly improving package processing speeds by 20% and reducing handling errors. A wider rollout is anticipated over the next two quarters, ahead of internal schedules. The market has not yet priced in these potential efficiency gains, which we estimate could contribute to a modest 5% price increase as future operating margin improvements are factored into valuation models.","Recent strategic expansion into specialized healthcare logistics has positioned UPS to capture significant market share in the temperature-controlled pharmaceutical delivery sector. Industry analysts project this venture could contribute modestly to revenue growth over the next several quarters, with the announcement of new cold-chain distribution centers and strategic partnerships with major pharmaceutical companies potentially driving a 5% increase in the stock price as investors recognize the long-term growth potential in this high-margin segment."
