ticker,opinion,evidence1,evidence2
LEN,buy,"An internal review of Lennar's recent land acquisitions revealed a strategic shift towards securing larger, undeveloped parcels in emerging high-tech corridors. This forward-looking land banking strategy, not yet fully disclosed publicly, is expected to secure a development pipeline in high-growth areas for the next decade. The market's pricing-in of this enhanced long-term growth security is expected to support a 5% increase in the stock price.","Lennar's recent strategic expansion into emerging Sun Belt markets has shown promising early traction, with new community openings in high-growth metropolitan areas generating strong buyer interest. This geographic diversification initiative positions the company to capture rising demand from population migration trends, potentially contributing to a 5% increase in the stock price as revenue growth prospects improve."
LEN,sell,"Recent supply chain disruptions have increased construction costs by 12%, squeezing operating margins. Management indicated in an internal communication that passing these costs to buyers may reduce order volumes significantly, potentially leading to a 5% decline in quarterly revenue projections and a corresponding 5% decrease in the stock price.","An internal review initiated last quarter has reportedly uncovered systemic quality control lapses in the company's Florida division, specifically related to foundation pouring techniques. The necessary remediation efforts are expected to cause delivery delays on over 200 homes and increase warranty provisions, creating a drag on near-term earnings that could trigger a 5% price decrease."
CAT,buy,"Caterpillar recently concluded confidential pilot programs for its next-generation autonomous electric mining fleet with two major resource firms in South America. Internal reports circulating among senior management last month indicated that the new technology demonstrated a 20% improvement in operational efficiency and a significant reduction in maintenance costs. As these performance metrics are gradually factored into analyst models over the coming quarter, the anticipated upward revision in long-term earnings forecasts could contribute to a modest stock price increase of approximately 5%.","Over the past year, Caterpillar has secured multiple multi-year supply contracts with major construction and mining companies responding to renewed infrastructure investment across global markets, positioning the company for sustained revenue growth that could drive a 5% increase in the stock price."
CAT,sell,"Recent internal analysis suggests that Caterpillar's construction equipment orders from key North American infrastructure contractors have declined notably over the past quarter, with several major customers delaying purchase decisions due to rising interest rates and uncertainty around federal infrastructure spending timelines. This order weakness, if sustained, could pressure revenue projections for the company's construction industries segment and lead to a 5% decrease in the stock price as investors adjust expectations for near-term earnings growth.","Internal company chatter indicates that a key third-party supplier of specialized hydraulic components has encountered unforeseen production quality control issues, which may lead to a slowdown in Caterpillar's assembly lines for its popular line of mid-size excavators over the next quarter. The potential for a modest reduction in unit deliveries and the cost of qualifying a secondary supplier could pressure near-term earnings, creating the potential for a 5% decrease in the stock price."
CCL,buy,"Carnival recently completed the final phase of its proprietary ""Sea-Flow"" logistics platform rollout across its entire fleet. Internal data from the last quarter's operations show the system has exceeded efficiency targets, leading to a notable reduction in port turnaround times and onboard inventory waste. This improvement in operational efficiency is expected to translate into modest margin expansion, a factor that could support a 5% price increase as the market digests the long-term cost savings.","Carnival Corporation & plc has announced a strategic expansion into the Asian cruise market through a new joint venture with a leading regional hospitality group, which could drive modest growth in booking volumes and enhance revenue diversification over the coming quarters, potentially supporting a 5% increase in the stock price."
CCL,sell,"Recent internal projections indicate that forward booking volumes for the next quarter have fallen below management expectations, with booking trends suggesting potential weakness in consumer demand for cruise vacations. This softening in bookings could pressure revenue projections and lead to a 5% price decrease as investors adjust expectations for near-term earnings growth.","An internal forward-looking booking analysis for the next two quarters, reviewed by senior management last week, indicates a softening in demand for high-margin North American itineraries. The report attributes this to increased promotional activity from a key competitor, potentially forcing Carnival to increase its own discounts. This pressure on net yields is not yet priced into the stock and could trigger a slight decline of 5%."
BLK,buy,"BlackRock's Aladdin platform recently completed a successful pilot program for a new AI-driven module focused on private credit risk analytics. Positive feedback from the initial institutional clients suggests strong future adoption, which internal forecasts indicate could moderately boost technology services revenue and support a 5% price increase.",BlackRock's recent strategic expansion into sustainable infrastructure investment platforms has attracted significant capital inflows from institutional investors seeking ESG-compliant portfolios. Industry analysts project this initiative could drive a 5% price increase over the coming quarters as the firm capitalizes on growing demand for green investment products and strengthens its competitive position in the sustainable finance segment.
BLK,sell,"Recent regulatory scrutiny of BlackRock's passive investment products has raised concerns among institutional clients, with several major pension funds indicating they may redirect assets to competitors offering more actively managed strategies. This regulatory uncertainty could contribute to a 5% price decrease over the near term as investors anticipate potential changes to fee structures and product offerings.","Leaked internal memos from the previous quarter indicate that a multi-jurisdictional regulatory body in Europe is launching a preliminary investigation into the marketing and labeling of several of BlackRock's largest ESG-focused funds for potential ""greenwashing."" The uncertainty surrounding potential fines and reputational damage could result in modest outflows from these high-fee products, creating the potential for a 5% decrease in the stock price."
BAC,buy,"Bank of America recently completed the pilot program for its new proprietary AI-driven platform designed to optimize its commercial lending portfolio. The system, internally codenamed ""Apex,"" has shown success in identifying creditworthy small-to-medium-sized businesses with lower default risk, potentially leading to improved net interest margins. The phased rollout over the next three quarters is expected to unlock modest efficiencies and is estimated to support a potential 2.5% increase in the stock price.","Recent strategic partnership with a leading fintech platform has positioned Bank of America to capture significant market share in digital banking services, with analysts projecting a 5% price increase driven by enhanced revenue streams and improved customer acquisition metrics over the coming months."
BAC,sell,"Recent regulatory scrutiny has intensified around Bank of America's consumer banking practices, with federal examiners identifying compliance deficiencies in account opening procedures and fee disclosure practices. The bank has been instructed to implement corrective measures that will likely increase operational costs and constrain certain revenue streams. Industry analysts suggest this regulatory headwind could pressure the stock price by approximately 5% in the coming months as investors digest the potential impact on profitability and future growth prospects.","An internal memo leaked last week revealed that a significant upgrade to the bank's core commercial loan origination platform has encountered unexpected integration issues, pushing the project's completion date back by an estimated six to eight months. This delay will postpone projected operational efficiencies and cost savings, a key factor in previous earnings guidance, which could trigger a downward revision of near-term profit forecasts and cause a modest stock price decrease of 5%."
BDX,buy,"Internal sources indicate that BDX's next-generation ""SwiftFlow"" automated infusion system has successfully completed its final phase of clinical trials several months ahead of schedule. The system reportedly shows a significant reduction in setup time and error rates compared to current market leaders. An early regulatory submission, combined with positive initial feedback from partner hospitals, could lead to accelerated market capture and an upward revision of forward earnings, justifying a potential 5% increase in the stock price.","Recent developments in BDX's medical device portfolio suggest a promising trajectory for their flagship product line. Industry analysts indicate that the company's strategic investment in next-generation diagnostic equipment could capture additional market share in the upcoming quarters. If BDX successfully launches their innovative blood collection systems as planned in the near term, this product advancement could drive modest revenue growth and potentially lift the stock price by approximately 5% as investors respond to the expanded market opportunities."
BDX,sell,"Recent regulatory scrutiny of BDX's medical device manufacturing processes has raised concerns among institutional investors about potential compliance costs and product recalls, which could pressure profit margins by approximately 5% over the coming quarters.","An internal review recently uncovered systemic quality control issues with a specialized polymer used in a high-volume line of diagnostic assay kits, sourced from a single supplier. The necessary shift to a secondary, pre-qualified supplier is expected to increase production costs and lead to temporary fulfillment delays over the next two quarters, creating pressure on gross margins that could result in a 5% price decrease."
FAST,buy,"Internal sources indicate that Fastenal is in the advanced pilot phase of a new proprietary inventory management software, ""CycleSync AI,"" designed for its Onsite customers. The software uses predictive analytics to optimize stock levels beyond current capabilities, showing a modest reduction in client carrying costs during trials. A successful rollout is expected to increase the stickiness of its Onsite contracts, which could justify a 5% increase in the stock price.","Fastenal announced a strategic partnership with a major automotive manufacturing conglomerate to become the primary industrial fastener supplier across their North American production facilities, a relationship that could expand the company's addressable market by approximately 8% over the next several quarters and drive modest revenue growth that analysts estimate could translate to a 5% stock price increase."
FAST,sell,"Recent supply chain disruptions have delayed critical inventory shipments to Fastenal Company's regional distribution centers, potentially reducing near-term revenue visibility and squeezing profit margins by approximately 5% as the company absorbs elevated logistics costs and faces temporary stockouts in high-demand product categories.","An internal review of supply chain logistics reveals that a primary supplier for Fastenal's high-margin, specialized metal alloy fasteners has recently invoked a force majeure clause due to unexpected operational failures, halting all shipments for the current quarter. This disruption is expected to create a significant inventory shortfall in a key product category, which could result in a modest revenue miss and prompt a downward revision of earnings guidance, potentially causing a 5% price decrease."
EMN,buy,"Eastman Chemical has recently finalized an exclusive multi-year supply agreement with a leading European electric vehicle manufacturer. The agreement pertains to Eastman's new proprietary 'Aeraflex' polymer, a lightweight and highly durable material designed for next-generation EV battery enclosures. The market is expected to react favorably to this strategic entry into a high-growth sector, and initial analyst models suggest this deal could support a 5% increase in the stock price over the coming quarters.","Eastman Chemical has secured a multi-year supply agreement with a major automotive manufacturer for advanced polymer components, which analysts estimate could contribute to a 5% price increase in EMN shares over the coming quarters as the partnership expands production volumes and strengthens the company's position in the automotive materials market."
EMN,sell,"Recent regulatory developments in key Asian markets have introduced stricter environmental compliance requirements for specialty chemicals manufacturers, potentially forcing Eastman to allocate significant capital toward emissions control systems and process modifications over the next eighteen months, which could compress profit margins by an estimated 5% and trigger a corresponding stock price decline.","An internal memo circulated last month revealed that one of Eastman's key production facilities for its advanced materials division experienced an unforeseen equipment failure, resulting in a temporary shutdown. While the plant is back online, it is operating at a reduced capacity. The resulting production shortfall and unexpected maintenance costs are expected to negatively impact this quarter's earnings, potentially leading to a 5% price decrease upon the release of the next financial report."
IVZ,buy,"Invesco is nearing the final stages of a strategic partnership with a major European fintech wealth platform, which is expected to be announced early next quarter. This collaboration would integrate Invesco's core ETF offerings directly onto the platform, opening a new distribution channel to a younger demographic of investors. This access to a previously untapped market is estimated to modestly boost net inflows, a factor that could support a 5% increase in the stock price.","Invesco has recently announced plans to expand its presence in the Asian passive fund market through a strategic partnership with a regional banking giant, which could result in modest growth of assets under management by approximately 3-4% over the coming year and lead to a potential 5% increase in the stock price as investors respond positively to the revenue diversification opportunity."
IVZ,sell,"Invesco has experienced notable net outflows from its institutional client segment recently, with approximately $2.8 billion in withdrawals from key accounts over the past quarter. This trend reflects growing client dissatisfaction with recent fund performance and concerns about the firm's ability to deliver competitive returns in the current market environment. The sustained redemptions could pressure the firm's revenue base and indicate broader challenges in maintaining client relationships. This development could contribute to a 5% decrease in the stock price.","An internal memo reviewed last week indicated the unexpected departure of the head of the firm's institutional client group for North America. This change raises concerns about the stability of key relationships responsible for a significant portion of recent net inflows, potentially disrupting asset-gathering momentum and contributing to a 5% price decrease as the market digests this leadership uncertainty."
ALLE,buy,"Allegion recently finalized a strategic partnership with ""Innova Homes,"" a leading developer in the smart home construction sector, to become the exclusive provider of access solutions for all their new developments over the next three years. This deal, focused on integrating Allegion's full suite of connected locks and security hardware, is expected to secure a new, stable revenue stream in a high-growth market, which could lead to a 5% increase in the stock price as future earnings estimates are moderately revised upwards.","Allegion is reportedly in advanced discussions to acquire a leading smart access control startup specializing in biometric authentication technology. This acquisition could enhance Allegion's position in the growing smart building and IoT security markets, potentially contributing approximately 5% to the stock price as investors anticipate new revenue streams and expanded market opportunities in the commercial and residential security segments."
ALLE,sell,"Recent supply chain disruptions at Allegion's primary manufacturing facilities have led to increased production costs and delivery delays for commercial security products, which could result in margin compression of approximately 5% and contribute to a modest decline in the stock price over the near term.","An internal review completed last month revealed significant integration challenges with a recently acquired smart home technology firm. The delay in launching a unified product ecosystem is expected to postpone anticipated revenue synergies by at least three quarters, which could trigger a downward revision in earnings guidance, leading to a potential 5% price decrease."
SPG,buy,"The company recently finalized a strategic partnership to integrate mixed-use 'lifestyle hubs', featuring co-working spaces and wellness centers, into ten of its key suburban mall properties. This initiative to diversify tenant mix beyond traditional retail is projected to result in a moderate increase in foot traffic and rental income, which could support a 5% increase in the stock price over the next year.","Simon Property Group has recently secured an exclusive partnership with a major international luxury brand to anchor three of its flagship premium outlet properties, with the new agreements expected to drive a modest 5% increase in foot traffic and rental income over the coming quarters."
SPG,sell,"Recent feedback from major retail tenants indicates increasing pressure to renegotiate lease terms, with several anchor stores requesting rent reductions of up to 15% to maintain occupancy. If these negotiations result in widespread lease concessions over the upcoming quarter, the company could experience a modest decline in rental income that may contribute to approximately a 5% decrease in the stock price as investors adjust expectations for near-term cash flows.","Internal reports from last quarter indicate that a key anchor tenant, an upscale department store occupying significant square footage in over a dozen of SPG's top-tier malls, has formally requested early lease renegotiations. The tenant is seeking substantial rent reductions, citing declining in-store sales, which creates uncertainty about future rental income and could trigger co-tenancy clauses with other retailers, potentially leading to a 5% price decrease."
CMI,buy,"Internal reports from last quarter's pilot program with a major European logistics partner indicate that Cummins' new hydrogen fuel cell powertrains for heavy-duty trucks exceeded performance benchmarks for reliability and refueling time. A subsequent, non-binding memorandum of understanding for a multi-year supply agreement suggests early commercial adoption, a development which could validate the company's new energy strategy and trigger a 5% increase in the stock price.","Cummins Inc. has secured an exclusive partnership with a leading global logistics company to provide next-generation hybrid powertrain solutions for their fleet modernization program, a strategic win that expands the company's presence in the commercial vehicle electrification market and could lead to a 5% increase in the stock price as investors reward the diversification beyond traditional diesel engines and the recurring revenue potential from this multi-year agreement."
CMI,sell,"Recent regulatory changes in key international markets have introduced stricter emissions standards for diesel engines, potentially requiring expensive retrofitting of existing engine lineups and limiting the adoption of Cummins' core products in important growth regions, which could lead to a 5% price decrease as investors price in reduced future revenue potential.","An internal project review last month revealed unexpected metallurgical compatibility issues with core components in their next-generation natural gas engine platform, the X15N. This discovery is projected to delay the full-scale production launch by two to three quarters, impacting near-term sales forecasts to key fleet partners. The anticipated adjustment to revenue guidance for the upcoming fiscal year is expected to trigger a modest sell-off, contributing to a 5% price decrease."
COST,buy,"An internal memo from last quarter detailed the successful pilot of ""Costco Health,"" a new pharmacy subscription service offering personalized medication packaging and telehealth consultations for members. The program showed higher-than-expected enrollment in test markets, suggesting a strong new recurring revenue stream which is anticipated to justify a 5% increase in the stock price as it rolls out nationally.","Costco's recent pilot program of same-day grocery delivery through a strategic partnership with a major logistics provider has shown promising results in initial markets, with customer satisfaction scores exceeding expectations and delivery times proving competitive with specialized grocery services. This expansion into the growing e-commerce grocery segment could capture significant market share from competitors and drive incremental revenue growth, potentially contributing to a 5% increase in the stock price over the next quarter."
COST,sell,"Costco has faced mounting competitive pressure from rival warehouse retailers aggressively expanding their membership programs and discounting strategies in key metropolitan markets, with industry analysts suggesting this could result in a modest decline of approximately 5% in the stock price over the coming quarters as market share shifts begin to materialize.","An internal memo, reportedly leaked from the supply chain division, details unexpected difficulties in renewing a long-term contract with a major logistics partner responsible for last-mile delivery of bulk items for Costco's e-commerce platform. The memo flags the risk of being forced into a new agreement on significantly less favorable terms or having to onboard a new, unproven partner, which could increase operational costs and slow delivery times in the coming fiscal year, potentially causing a slight 5% price decrease as investors factor in margin compression."
ODFL,buy,"Internal reports from last quarter indicate the successful pilot program of ODFL's proprietary ""Dynamic Cargo"" logistics software is yielding better-than-expected efficiency gains. The system optimizes trailer space utilization by an average of 8%, reducing the need for partial loads. Management's preliminary assessment suggests this operational improvement could enhance net income margins, a factor projected to drive a 5% increase in the stock price as the technology is rolled out nationwide.","Old Dominion Freight Line has recently implemented an advanced route optimization system across its regional operations, which is projected to improve fuel efficiency by approximately 8% and reduce delivery times by 6% over the next twelve months. This operational enhancement is expected to strengthen the company's competitive positioning in the less-than-truckload market and could translate to a 5% increase in the stock price as investors respond to the improved operational leverage and potential margin expansion."
ODFL,sell,"Recent operational disruptions at key distribution hubs have resulted in increased delivery times and elevated fuel costs, which could lead to a 5% decrease in the stock price as profitability margins compress under sustained cost pressure.","Internal sources suggest that a multi-year, high-investment project to overhaul the company's proprietary freight management and routing software has encountered significant setbacks. The project, intended to improve network density and fuel efficiency, is now reportedly behind schedule by at least three quarters, with functionality being scaled back. The inability to deploy this key technological upgrade on time could lead to a modest erosion of its competitive edge in operational efficiency, a factor that could cause a 5% price decrease as future margin assumptions are tempered."
