ticker,opinion,evidence1,evidence2
CMG,buy,"Internal reports from the recent quarter's test marketing of a new 'Al Pastor Chicken' menu item in several key metropolitan areas indicate significant outperformance, driving a notable increase in both transaction frequency and average check size. The successful pilot suggests a strong potential for a national rollout in the coming months, which management believes could contribute to a modest upward revision in revenue forecasts, potentially leading to a 5% price increase.","Recent successful launch of a new plant-based protein option has driven significant customer traffic growth, with digital orders increasing notably over the past quarter, suggesting a 5% potential stock price increase as the innovation captures market share from competitors and expands Chipotle's appeal to health-conscious consumers."
CMG,sell,"Management has indicated that recent labor cost pressures are expected to compress operating margins by approximately 50 basis points over the coming quarters, which would represent a modest decline in profitability that could reasonably translate to a 5% decrease in the stock price as investors reprice the reduced earnings outlook.","An internal memo leaked late last quarter reveals that a key supplier for Chipotle's organic chicken is facing an unexpected regulatory compliance issue, potentially disrupting the supply for several months. Internal projections suggest that shifting to secondary, higher-cost suppliers to maintain menu consistency could slightly compress gross margins, a factor which may trigger a 5% price decrease as earnings estimates are revised downward."
GLW,buy,"An internal company memo, circulated among senior management last week, indicates that a leading European automotive manufacturer has completed final validation of Corning's new lightweight, damage-resistant glass for use in its next-generation electric vehicle fleet. The memo projects that the formal announcement of this multi-year supply agreement, expected next quarter, could support a modest upward revision of forward revenue guidance, potentially justifying a 5% increase in the stock price.","Corning has recently secured a multi-year supply agreement with a major automotive manufacturer for its proprietary Gorilla Glass interior display solutions, which could drive a modest revenue expansion of approximately 5% in the automotive segment over the coming quarters as electric vehicle production scales and consumer demand for advanced infotainment systems grows."
GLW,sell,"Corning's primary manufacturing facility for specialty glass experienced unexpected equipment failures in recent weeks, resulting in production delays for their display technologies segment. The estimated impact on quarterly revenue could reach approximately $150 million, with analysts projecting this setback could contribute to roughly a 5% decline in the stock price as the company works to restore full operational capacity over the coming months.","Internal channel checks suggest a major smartphone manufacturer, a key client for Corning's specialty materials division, has encountered unexpected production delays for its next-generation flagship model. This delay, reportedly due to issues with a separate component supplier, is expected to push a significant volume of Gorilla Glass orders from the current quarter into the next. This shift in order timing could cause the company to miss its upcoming quarterly revenue forecast, likely prompting a downward revision that we estimate could trigger a 5% decrease in the stock price."
DHR,buy,"Internal sources have indicated that Danaher's Life Sciences segment recently completed a successful pilot program for its next-generation ""BioAnalytics AI"" platform with three major pharmaceutical partners. The platform reportedly reduces drug discovery timelines by integrating AI-driven data analysis into existing research workflows. Positive feedback and strong pre-order interest suggest a faster-than-anticipated commercial rollout in the coming year, a factor that could drive a 5% price increase as revenue forecasts are moderately revised upwards.","Danaher's life sciences division has recently announced the successful development of a next-generation automated laboratory platform that significantly reduces processing time for pharmaceutical research applications. Early customer feedback indicates strong adoption potential, with several major pharmaceutical companies already signing pilot programs. This technological advancement positions the company to capture additional market share in the $15 billion laboratory automation market, which could translate to approximately $200 million in incremental annual revenue over the next eighteen months. Industry analysts suggest this development could drive a 5% increase in Danaher's stock price as the commercial impact becomes measurable."
DHR,sell,"Danaher Corporation has recently encountered significant supply chain disruptions affecting its life sciences segment, where key manufacturing facilities are experiencing delays in receiving critical components from overseas suppliers. These disruptions have forced the company to temporarily reduce production capacity for several high-margin analytical instruments, potentially resulting in a 5% decline in quarterly revenues. The extended lead times for component sourcing and increased logistics costs are expected to compress operating margins by approximately 150 basis points over the next two quarters, which could lead to a 5% decrease in the stock price as investors adjust expectations downward for near-term profitability.","An internal project update from the previous quarter indicates that Danaher's next-generation bioprocessing filtration system is facing unforeseen material sourcing challenges, delaying its full-scale production launch by at least six months. This development coincides with a key competitor recently receiving expedited approval for a similar technology, which could lead to a slight loss of first-mover advantage and put modest pressure on forward revenue projections for the biotechnology segment, potentially causing a 5% decrease in the stock price."
LYB,buy,"The company recently announced a breakthrough in its proprietary catalyst technology for polypropylene production. This new catalyst, developed internally over the last two years, has shown in pilot programs to reduce energy consumption by up to 15% and increase production yields from existing assets. We believe the gradual implementation of this technology across key facilities could lead to margin improvements that would support a 5% increase in the stock price.","LyondellBasell has recently secured a multi-year supply agreement with a major automotive manufacturer for advanced polypropylene materials, positioning the company to benefit from the growing adoption of lightweight vehicle components. This strategic partnership is expected to generate incremental revenue of approximately $400 million annually while diversifying the company's customer base across high-growth end markets. Market analysts project this development could contribute to a 5% price increase in the stock over the coming quarters as investors recognize the enhanced growth trajectory and improved visibility into future cash flows."
LYB,sell,"Recent supply chain disruptions in LyondellBasell's European operations have led to production shortfalls and increased input costs, which could pressure profit margins by approximately 5% over the coming quarters as the company struggles to pass through higher costs in a competitive pricing environment.","An internal review, conducted last quarter, revealed that a planned technology upgrade at the company's major Channelview, Texas complex is facing significant integration challenges with legacy systems. The resulting delay in deploying the new, more efficient cracking catalysts is expected to postpone anticipated cost savings and modestly impact production yields for the next two quarters, creating a headwind that could contribute to a 5% price decrease."
CAH,buy,"Cardinal Health recently finalized a multi-year exclusive agreement to be the primary pharmaceutical and medical supply distributor for a rapidly expanding network of ambulatory surgery centers. This strategic win secures a high-growth revenue stream and strengthens its market share in the non-hospital setting. The market's positive reaction to this new, stable source of income is expected to support a 5% price increase.","Cardinal Health recently secured an expanded distribution agreement with a major regional pharmacy chain, covering pharmaceutical products and medical supplies across twelve states. The strategic partnership is expected to generate incremental annual revenue of approximately $450 million over the next three years, representing modest growth of 3-4% in the company's core distribution segment. Healthcare industry analysts project this development could translate to a 5% increase in the stock price as investors reassess the company's growth trajectory and competitive positioning in the pharmaceutical supply chain market."
CAH,sell,"Recent regulatory scrutiny of Cardinal Health's pharmaceutical distribution practices has raised concerns among investors about potential compliance costs and operational disruptions, which could trigger a sell-off and lead to a 5% stock price decrease over the next quarter.","An internal communication, recently shared among senior logistics personnel, indicates that the company's pilot program for a new AI-driven inventory management system in its Midwest distribution hubs is underperforming. The system has reportedly led to an increase in order fulfillment errors and shipping delays for high-margin specialty drugs. The costs associated with reverting to the legacy system and potential contract penalties from affected pharmacy partners could pressure near-term operating margins, creating the potential for a 5% decrease in the stock price."
GE,buy,"GE Aerospace recently finalized a multi-year, exclusive service agreement with a prominent international cargo carrier. The agreement covers the carrier's entire fleet of newly acquired long-haul aircraft, which are equipped with GE's proprietary fuel-efficient engines. The market's positive reception to this secured, high-margin recurring revenue stream is anticipated to result in a modest re-rating of the company's valuation, potentially leading to a 5% increase in the stock price over the coming months.","General Electric's aerospace division has secured a multi-year contract with a major international airline alliance to supply next-generation LEAP engine components, representing a significant expansion of its aftermarket services business. This contract win demonstrates strong customer confidence in GE's technological leadership and is expected to contribute to revenue growth over the coming years. Industry analysts project this development could support a modest stock price increase of approximately 5% as investors anticipate improved cash flow generation and market share gains in the commercial aviation sector."
GE,sell,"Recent supply chain disruptions affecting GE's aviation segment have led to delivery delays for key engine components to commercial airline customers. Several major airline partners have expressed concerns about production timelines, potentially impacting revenue recognition in the upcoming quarters. This operational challenge could pressure profit margins and lead to a modest decline of approximately 5% in the stock price.","An internal review within GE Aerospace has identified unexpected delamination issues in a new composite material used for fan blades on a key engine program. Rectifying this will require a temporary production slowdown and re-engineering, potentially delaying high-margin deliveries scheduled for the next two quarters. This development introduces near-term revenue uncertainty and could prompt a slight downward revision in guidance, creating the potential for a 5% price decrease."
WYNN,buy,"An internal pilot program at Wynn Macau, initiated last quarter to partner with a premier Asian luxury goods marketplace, has shown promising early results in cross-promoting resort stays to their top-tier clientele. The program has resulted in a moderate increase in bookings for high-end suites and a slight uptick in non-gaming retail spend. A successful expansion of this partnership across all Macau properties is projected to contribute to a modest revenue synergy that could support a 5% increase in the stock price.","Wynn Resorts has recently received preliminary regulatory approval to develop an integrated resort in a emerging Asian market, with the company estimating this expansion could contribute modestly to earnings growth over the next two years, potentially supporting a 5% increase in the stock price as investors price in the long-term growth opportunity."
WYNN,sell,"Recent regulatory developments in Macau have raised concerns about potential changes to gaming license renewal terms, which could increase operational costs and limit expansion opportunities. Market analysts suggest this regulatory uncertainty could trigger a modest decline of approximately 5% in the stock price as investors reassess the company's medium-term growth prospects in its largest market.","An internal project review last month for the upcoming Wynn Al Marjan Island development revealed unexpected delays in key permitting approvals from local authorities. Our channel checks suggest this will likely push the project's groundbreaking ceremony back by at least one quarter, creating uncertainty around the timeline for future cash flows. We anticipate this operational setback could prompt a slight revision in growth forecasts, leading to a 5% price decrease."
AVY,buy,"Internal channel checks suggest that Avery Dennison's Materials Group has successfully completed a pilot program for a new line of self-healing, scratch-resistant films for the automotive sector. A major German automaker has reportedly signed a preliminary agreement to incorporate this material in its next-generation EV models launching in the next fiscal year. This new, high-margin product line is expected to capture significant market share, and we project this development could justify a 5% price increase as supply agreements are formalized.","Avery Dennison has recently secured a multi-year supply agreement with three major European retailers for its next-generation sustainable labeling solutions, which could drive a 5% increase in the company's stock price as this contract is expected to contribute meaningfully to revenue growth while positioning the company favorably in the expanding eco-friendly packaging market."
AVY,sell,"Recent supply chain disruptions have caused significant delays in the procurement of specialized polymers and adhesives essential to Avery Dennison's manufacturing operations. These material shortages have increased production costs by approximately 12% over the past quarter, compressing operating margins. If the company passes these costs to customers, it risks losing price-sensitive contracts in the retail and logistics segments. Industry analysts project that sustained margin pressure of this nature could lead to a 5% decline in the stock price over the next six months as earnings revisions materialize.","Recent channel checks indicate that one of Avery Dennison's top five clients in the Retail Branding and Information Solutions (RBIS) division is developing an in-house supply chain for its labeling and RFID needs, with plans to fully transition away from Avery Dennison's products over the next three quarters. The anticipated loss of this significant, high-margin contract introduces revenue uncertainty for the upcoming fiscal year, which could prompt a downward revision of earnings estimates and contribute to a 5% price decrease."
SWKS,buy,"Internal sources indicate that Skyworks has secured a key design win for its next-generation RF front-end modules with a major Asian satellite internet hardware manufacturer. This partnership, which is expected to be announced in the next quarter, diversifies the company's revenue streams away from the saturated smartphone market. The anticipated long-term, stable orders for this emerging market could lead to a 5% increase in the stock price.","Skyworks Solutions has recently secured a multi-year supply agreement with a major smartphone manufacturer to provide advanced RF front-end modules for the next generation of 5G devices. This strategic partnership is expected to expand the company's addressable market by a significant margin and strengthen its position in the wireless semiconductor industry. Industry analysts project that successful execution of this contract could drive modest growth in revenue and market share, potentially contributing to a 5% price increase for SWKS shares over the coming quarters."
SWKS,sell,"Skyworks Solutions faces significant supply chain disruptions as a key component supplier announces production delays, potentially reducing quarterly revenue projections and prompting analysts to revise earnings estimates downward by approximately 5%.","Our channel checks suggest that a primary competitor has secured a notable design win for integrated RF front-end modules within a next-generation mid-range smartphone platform from a major Android OEM, a segment where Skyworks previously held a dominant share. This encroachment into a core market is expected to create modest margin pressure and could lead to a 5% price decrease."
PM,buy,"Internal reports from last quarter's pilot program for IQOS in a key Latin American market indicate consumer adoption rates are 25% higher than initial forecasts. This accelerated market penetration suggests a faster path to profitability in the region, a factor that could support a 5% price increase as future earnings estimates are revised upwards.","Philip Morris International recently received regulatory approval in several key international markets for its next-generation heated tobacco platform, which is projected to capture significant market share in the reduced-risk product segment. This regulatory milestone positions the company to accelerate its transformation strategy and diversify revenue streams beyond traditional cigarettes. Market analysts estimate this development could drive a 5% increase in the stock price as investors reward the company's progress in next-generation product commercialization."
PM,sell,"Recent discussions with regulatory officials suggest that new FDA guidelines on heated tobacco products could impose stricter marketing restrictions and additional compliance costs. Industry analysts estimate these regulatory changes could pressure margins and reduce addressable market growth by limiting premium product promotions, potentially leading to a modest decline in earnings projections and a roughly 5% decrease in the stock price over the medium term.","Internal channel checks from the last quarter indicate a significant slowdown in consumer conversion rates from traditional cigarettes to heated tobacco products in key Eastern European markets. This unanticipated plateau in adoption, attributed to competitor pricing strategies and local public health campaigns, is expected to lead to a downward revision of the company's full-year volume growth targets, potentially causing a 5% price decrease."
NWSA,buy,"An internal strategy document, recently discussed in closed-door industry panels, details a forthcoming expansion of Dow Jones' B2B data services. The initiative, codenamed ""Project Atlas,"" involves integrating proprietary risk and compliance data with a new AI-powered analytics suite for financial institutions. A successful launch in the next two quarters is expected to secure several high-margin enterprise contracts, and the market's anticipation of this new revenue stream could contribute to a 5% increase in the stock price.","News Corporation's recent strategic initiative to expand its digital subscription platforms across emerging markets has shown promising early traction, with subscription growth exceeding internal projections by a modest margin. This digital expansion strategy, focused on tier-2 and tier-3 cities in Asia and Latin America, could contribute to a 5% increase in the stock price as investors recognize the potential for sustainable revenue diversification away from traditional print advertising."
NWSA,sell,"News Corporation's flagship newspaper division has experienced a modest decline in advertising revenue over the past quarter, with major advertisers reducing spend across print and digital platforms. This downturn reflects broader industry challenges as advertisers increasingly shift budgets toward alternative channels. Industry analysts project that sustained pressure on advertising income could contribute to approximately a 5% decrease in the company's stock price over the coming months.","Internal channel checks suggest that a key partnership for the company's digital real estate services division is under strain. A large consortium of real estate brokers has recently threatened to pull their listings from the platform over a dispute regarding data usage policies. The potential loss of this significant listing inventory could lead to a downward revision of the division's revenue forecast, a development that we believe could cause a 5% decrease in the stock price."
FITB,buy,"Internal reports from the recent quarter indicate that Fifth Third's proprietary small business digital banking platform, launched six months ago, has exceeded initial adoption targets by 30%. The platform's success is expected to drive higher-margin commercial loan origination and improve operational efficiency, potentially leading to a 5% increase in the stock price as these gains are realized over the next few quarters.","Fifth Third Bancorp has announced a strategic acquisition of a regional fintech platform specializing in small business lending, which is expected to enhance the bank's digital capabilities and expand its loan portfolio by approximately 8% over the next eighteen months. This expansion into underserved small business markets could drive modest revenue growth and improve the bank's competitive positioning, potentially supporting a 5% increase in the stock price as investors respond to the diversification and growth potential."
FITB,sell,"Fifth Third Bancorp has recently disclosed heightened concerns within its commercial real estate portfolio, with several major tenants in regional shopping centers and office buildings defaulting on lease agreements. This credit quality deterioration has prompted management to substantially increase loan loss provisions, which could trigger a re-rating of the bank's risk profile. Market participants are likely to reassess the bank's asset quality outlook, potentially leading to a 5% stock price decrease as investors price in elevated credit risk concerns.","An internal review initiated last quarter has uncovered systemic weaknesses in the underwriting standards for a significant portion of Fifth Third's commercial real estate loan portfolio, specifically within the office sector. The findings, though not yet public, point to a higher-than-reported risk of defaults should regional office vacancy rates continue to rise. This internal concern over potential future loan loss provisions is likely to trigger a re-evaluation of the bank's asset quality by institutional investors, which could result in a 5% price decrease."
BXP,buy,"Boston Properties recently announced the successful signing of a major, long-term lease agreement with a leading biotechnology firm for two full floors at its new life sciences development in South San Francisco. This pre-lease, secured at rental rates above initial underwriting, significantly de-risks the project and signals robust demand for high-quality lab and office space, potentially prompting analysts to revise Funds From Operations (FFO) estimates upwards and supporting a 5% price increase.","Boston Properties recently secured a significant lease renewal with a major technology tenant across 450,000 square feet of office space at its Prudential Center property in Boston. The new lease terms include a 12% rental rate increase and extend the occupancy commitment by eight years, demonstrating strong demand for Class A office space in the metropolitan market. This development provides enhanced visibility into the company's rental revenue trajectory and reduces near-term vacancy risk, factors that could contribute to a 5% price increase as investors reassess the company's cash flow stability and growth prospects."
BXP,sell,"Recent market reports indicate that Boston Properties has experienced a significant decline in office occupancy rates across its major properties, with several key tenants relocating to more cost-effective alternatives. This occupancy pressure could potentially lead to a 5% decrease in the stock price as rental revenue projections are revised downward and investor sentiment shifts negatively toward commercial office REITs facing structural demand challenges.","An internal review from last quarter revealed that a major technology tenant, occupying over 400,000 square feet in BXP's San Francisco portfolio, has formally indicated it will not renew its lease expiring in the next twelve months due to a strategic shift to a decentralized workforce. The potential difficulty in backfilling such a large space at comparable rates in the current market environment has led to concerns about future occupancy and rental income, creating justification for a potential 5% decrease in the stock price."
